,用户名,评论星级,评论时间,评论内容
63,颜丑文良,5,2019-05-27 10:57:51,关于宏村，最先值得一提的景点，是宏村整体造型——堪称“中华一绝”的古水系牛形村落，是当今世界历史文化遗产的一大奇观。这个始建于宋代的村子，至今依旧较好地保存着数百户粉墙青瓦、鳞次栉比的古民居群，特别是精雕细镂、飞金重彩的承志堂、敬修堂；气度恢宏、古朴宽敞的东贤堂、三立堂；森严的叙仁堂、上元厅等祠堂和南湖书院；巷门幽深，青石街道旁古朴的观店铺……同平滑似镜的月沼和碧波荡漾的南湖，雷岗上参天古木、民居庭院中的百年牡丹与探过墙头的青藤石木，构成一个完美的艺术整体。沿着主路慢行，还能欣赏到南湖风光、南湖书院、月沼春晓、牛肠水圳、双溪映碧、亭前大树、雷岗夕照、树人堂、明代祠堂乐叙堂等。若时间允许，不妨走访村周，还有闻名遐迩的雉山木雕楼、奇墅湖、塔川秋色、木坑竹海、万村明祠“爱敬堂”等著名景观。门票宏村：门票104元，学生（研究生证不可用）、60岁以上老年人、未成年人等凭有效证件，按旺季门票价格减半优惠；70岁以上持《安徽省老年人优待证》老年人、1.1m以下儿童等免票；请住宿客栈的老板帮买票可打9折。总门票内包含导游免费讲解（导游在南湖入口处认领）及几处景点门票。入门需登记身份证，购票起3日内可凭票进出村庄，记得随身带票券及半价证件。其余景点收费：德义堂：参观2元/人，喝茶5元/人碧园：参观拍照5元/人（目前宏村景点各个堂拍照免费）承德堂：参观拍照2元/人（目前宏村景点各个堂拍照免费）根心堂、琴剑阁、剑琴阁等也都有类似的参观喝茶收费Tips：1.宏村已被公司承包，逃票很难，连村内老百姓的亲戚进村探亲都要买票，除非你天黑进去，天不亮出来，哪怕早晨6:00在村里晃悠都很可能会遇见查票的。检票制度也非常严格，一定要真实证件才可过关。2.村里很容易把人转糊涂了，房屋、街道几乎没有差别。路边沟里的水流告诉我们行进的方向：逆流——进村，顺流——出村。
64,直觉,5,2019-05-07 18:14:32,确实很有特色的古镇，就算对我这种不喜欢古镇的人来说也是的！
65,汤姆猫,5,2019-04-02 17:00:25,到了宏村，最直观的感受是，宏村的美，一多半美在了它的两大标志性景点月沼和南湖。水的存在为古村增添了千种风情、万般气象，徽派建筑秀美的身影投射在灵动的湖面，构成了天然的山水中国画卷。
66,鸿行天下,5,2019-04-02 13:15:46,也就那样，去过一次不想去第二次。
67,渔乡余香,5,2019-04-01 16:53:29,徽派建筑群是最近我心中 “最美古村落” 形象的了。月沼是标志性地点吧。在小巷里随便走走，常规游览的话傍晚到早上走就可以了。想多住几天安静一下也可，一定要避开节假日。
68,✨晶晶✨,5,2019-04-01 11:16:18,随便拍拍都是一副绝美的画，超有意境
69,丢丢欣,5,2019-04-01 00:12:16,很上相的一个地方，实际的话感觉还是一般的，没有多少居民，有很多学生在画画，拍照确实比较漂亮
70,哈仙岛,5,2019-03-31 07:01:07,徽派建筑很美，这里到处都可以看到粉墙黛瓦，小桥流水的场面，一切都是静静的美。有着浓厚的商业气息。和自己居住的哈仙岛完全不同。
71,行者游侠,5,2019-03-26 16:25:19,非常的漂亮，非常棒，还会再去的
72,luoluo,5,2019-03-26 15:25:18,去的时候下雨，对宏村印象不是很好，玩着玩着，觉得景色还是不错的，就是雨水有点影响心情
73,蜡笔笔笔,5,2019-03-21 16:12:03,宏村的美，主要在建筑，白墙黑瓦南湖，南湖是真的美，早晨夜晚都好看，夏天冬天也好看，写生的人是一群一群的。
74,张小肥肥肥儿,4,2019-03-19 16:26:55,商业化有点严重，看看建筑还行吧。
