,用户名,评论星级,评论时间,评论内容
0,Amy,3,2019-03-25 13:33:07,我就在北京呆一天，一定要去的只有毛主席纪念堂和故宫。毛主席纪念堂就是情结，必须要去，故宫我是2008年去过一次，觉得看的不过瘾，而且间隔十一年，故宫也有很大变化，所以这次也必须去。我是今年三月二十四日去的，早上十点到下午两点吧，高峰期时段，这次故宫给我的体验不好，虽然各种宫殿，展览一如既往的好看，用心，但是人太太太太多了，只要是室内展厅，完全是摩肩接踵，你一般都挤不到玻璃跟前去，比如珍宝馆。钟表馆，过大年展览等。尤其是钟表馆和珍宝馆，我直接放弃看了。而且故宫内没有直饮水，不知道是否出于安全考虑，如果不是真该设置一个，为游客提高便利。感觉故宫是太好了，所以人不管什么时候都不少。真的参观体验太差了，我觉得除非故宫现在限流从八万人再减少一半，我才再会去故宫了。。。。图三是过大年展厅里照的一张。
1,蒙闭闭,3,2019-12-04 14:18:32,提前买票，凭身份证原件入场坐地铁，天安门东站下车。往午门方向走，因为只有午门可以进故宫。这一路走得我怀疑人生，人多，跨行[流泪]好不容易到了午门，人从众人从众，大烈日排队入场。幸亏不用排太久。入场后，人从众人从众人从众[流泪]烈日灼心除了红墙绿瓦，其它什么都看不到，人群掰不开啊！里面看不到有导览器租，在X程买了手机电子导览服务，结果，手机信号极奇弱，听着听着就卡或暂停。珍宝馆和钟表馆我是买票了的，但是，看到馆外等进馆的队伍，怕呀！果断走人。逛了一个多小时，实在提不起观赏欲望，走了。最后走了好远好远好远才到地铁站。回来发现，竟然没有一张自己在故宫的照片
2,Kumiko,3,2019-12-04 17:28:11,就过个场，人也特别多，每个宫也都是封着的，门口看一下就走，人多还挤不到门口看。就这样吧。喜欢历史剧的应该觉得不错
3,快快快121,3,2019-09-09 22:38:04,王者之风。风景真的没话说。但是服务就一言难尽了。
4,马蜂窝用户,3,2019-05-26 17:17:23,现在故宫的大殿都是大门紧闭，根本没啥看的了，怪不得门票这么便宜
5,Ben,3,2019-06-08 17:31:17,几个主要宫殿 警戒现实现实是拉的太远了 感觉就是在比眼力
6,起个名字太麻烦了,3,2019-06-04 07:59:40,特别好，很不错。特别好，很不错。
7,Jackee,3,2019-05-12 19:28:18,第二次游故宫隔了20年，游客太多，好多宫里的用品都没摆设了，宫殿门窗老化，馏金彩画退色
8,黑哥出品,3,2019-05-09 11:50:02,去过北京无数次居然没能进入看看😂遗憾
9,流浪睡客,3,2019-05-06 16:31:24,故宫是过去皇上的宫殿，里面是各种殿，景色一般。
10,Aqua阿瓜,3,2019-04-07 13:02:51,北京经典景点。老实说我不想给太高的分数。这个文物本身的历史价值是没得说了。但是整个经典的服务体系感觉非常吃老本，体验不那么舒服了。
11,bxqwolf,3,2019-03-22 11:33:37,来北京.不进故宫算来旅游么？而且现在故宫在单霁翔馆长的带领下.各种文创产品层出不穷.我会告诉你我用的是故宫口红么？
12,豌豆黄山楂糕,3,2019-03-11 13:25:49,年前二十九，人嘛，依然很多，奔着特展，天灯，万寿灯，宫灯和年画去的，随便逛逛慈宁宫的大集。但是一到地方，就感觉，这只能是个打卡的地儿，细看不了，细品不了。人挨着，挤着，排队进特展，进入之后，很难挤到展品跟前，也无心看什么介绍，听着服务人员喊，别停，往前走。年画和宫灯还是可以放慢点脚步，多看看。好希望能在红墙琉璃瓦下慢慢溜达。哈哈哈，估计是痴人说梦吧。
13,小我啊,3,2019-02-25 15:30:17,因为看了很多游记说最好购买自动讲解器，所以我也购买了一个。然后怒而写这条评论：真的没必要花这20块钱！这个东西的识别系统绝对有问题，该讲的时候不讲。等我离开这个点了才开始讲，从午门进来到侧门的过程全程静音。然后等我到了军机处，开始源源不断的讲，没讲完就切断到下一段接着讲。军机处介绍一半开始讲苏东坡，还没离开军机处就切成旁边的门
14,Gemini,3,2019-02-03 14:40:22,对人文历史不感兴趣，进入就是逛逛，到北京必须去的地方
15,丫Y,3,2019-01-12 15:42:06,不错的地方，可以让孩子们去看一看
16,一位很拉风的青年,3,2018-12-23 10:10:16,故宫感觉还可以，强烈推荐大家去看看。
17,花二和她的朋友们,3,2018-12-13 11:45:16,人超级多，真的是非常多，然后感觉游览故宫全程都是很赶的，一点都不愉快
18,梦幻小木马,3,2018-11-14 12:34:56,故宫的门票当天在网上买就能用，不需提前。好不容易逛到了8点半，排队进宫，在门口租赁了一个自助讲解器，20元一人，信号不是太好，断断续续，不建议租赁。如想听介绍，路上有很多带团导游，听他们的比讲解器好太多。高温，也没能阻止大家进宫热情。除了感叹紫禁城宏伟外，更感惜没自备干粮，一路悠闲散步，有零食在手就更完美了。故宫内虽有餐饮店，但价贵且味贱，跟迪士尼不相上下。
19,汕頭姨,3,2018-08-20 14:38:13,因为我们刚好去的是暑假其实人流量不是很多，所以每天限制八万人完全不怕买不到票，我去到故宫博物馆门口才开始上官网买票的，需要实名制购票，60元/人，小孩子不到一米二不用钱。我们都是按故宫的地图上的箭头走的，这个路线刚好也不会走回头路，而且所有景点都能逛到，想去的话可以按照这张图这个路线走，没问题的，但是我们没有进去珍宝馆和钟表馆，因为母亲说这些她不想看，所以就没进去，如果想去进去的话可以在官网买票时一起购买上，珍宝馆和钟表馆一样都是各10元/人，如果不确定要不要去的话也可以先买故宫的票，到了珍宝馆或者钟表馆想进去时再现场买票即可，但是一样价格。还有吐槽一下故宫租用的电子导游机一个20块钱，非常不好用，说是到了景点就会自动讲解，但是有时候已经过了景点她才开始讲，完全没用，我就傻乎乎的带了一整个故宫，完全没啥用，推荐一个APP可以听故宫每个殿的讲解典故的，<喜马拉雅FM>，接下来几天的出行几乎都是用她非常方便。
20,马蜂窝用户,3,2018-08-09 15:34:58,"，一9jbuz1@1:,72-4:？2q2（ '▿ ' ）1"
21,橙子,3,2018-07-25 20:35:08,这个是我第一次看这种有经典性的场景，个人觉得是非常壮观的 还是值得一去的
22,立习习〓区鸟,3,2018-07-21 11:38:05,在这里说一句，故宫订票一定要上午去的，下午很快就清场
23,马蜂窝用户,3,2018-07-15 20:04:57,去北京一定要去看故宫。可惜里面的工作人员脾气非常不好。里面的礼品商店千万不能拍照，惹人骂。乾清宫旁边的礼品店好像有个坐龙椅拍照的地方。工作人员会逼你排队拍照。我不想拍照，只想看里面的故宫纪念品，结果工作人员骂我还用扇子打我的手臂。真的好扫兴。
24,苗苗,3,2018-07-15 11:39:14,总结：人…人…人，到处都是人。听说一些殿以前还可以进去的，现在都不行了，拉个列岛线一大堆人就站在门口伸长脖子看啊看，能进去的地方能看到的东西也不多。钟表馆和珍宝馆，确实有值得看的东西，但是感觉国博的东西更多一些，又好看。没去过北京的体验一下还是不错的，就是人多。故宫说有9999间殿，但实际上开放的也不多，逛起来大同小异，感觉半天还是逛的完的。
25,十七,3,2018-06-06 23:33:58,皇城，远远望去，宏伟建筑，一方霸业。可它已成为历史，空空如也。
26,北方的空地,3,2018-06-03 16:16:11,因为对明清历史了解甚少，又看了不少网友的攻略和游记，大家都说一定要租讲解器，但是我真心觉得这个东西太不好用，不建议租，因为感应根本不好使，有时候你在这个景点晃悠的时候它不说话，等你到下一个景点它说的确是上一个景点的介绍，差评！！！
27,小帆的旅行日记,3,2018-05-30 12:06:42,这个地方 人山人海 如果想找到古代的感觉 那么 除非这里没有几个人逛 不然你进去完全找不到那种复古的感觉 就是看人 很焦躁很烦的那种看人 不推荐去
28,rakue7,3,2018-05-07 11:24:39,来北京必打卡景点 不过大家也懂的 就是这样
29,木子九日,3,2018-04-05 14:21:09,无论何时人都多，然后开放地点不多，和想看的不一样，不开放，开放的地方搞几个摆设给你看看，主要的几个大殿都是围栏围住的，没灯基本看不了什么，还里三层外三层的人……
30,蚂蜂窝用户,3,2018-03-16 15:43:24,皇家宫殿 文化遗产 身为国人确实都该去看看 很大 要用两个小时来逛 还是有些宫不开 七月一号起全部是网上售票 扫码预定 要是计划要去的话 无论几点过去 建议先在网上买了票 不然到了也进不去 故宫一天貌似是限八万人次
31,董俏梅kira,3,2018-02-28 09:22:18,"有没有2017.8.4日或者到8.7日之间想要一起游北京城的呀，有的话请联系微信dddcherry,一个人想找个小伙伴喲"
32,ME游鱼儿,3,2017-08-02 17:04:32,听导游说故宫平时周一是闭馆的，只有七八月暑假之时周一才开放。在故宫，有很多人文历史，导游给每人配备了一个无线耳麦，给我们讲解故宫的人文历史。
33,沐阳先森,3,2017-08-01 17:35:19,说实话真的太一般了，而且从早到晚满满的人群也不利于去慢慢品味历史韵味，只有后面那个御花园还不错，里面有些沧桑的老树
34,Dinnnn,3,2017-07-27 21:30:58,开放的区域都没多大兴趣，而且殿内无法看清，大三重的人群隔开了
35,blue,3,2017-07-23 17:48:55,一般般，暑假人太多了。。。随便看看走了
36,aicey,3,2017-07-18 13:06:57,还不错哦，和家人一起来看的，想看好久了
37,蚂蜂窝用户,3,2017-07-18 12:17:26,暑假太热了，上午全是人在中轴线上，可能下午会好一些，实在走不动，所以中午就出来了，真的好大，理解为什么皇上出门要做轿子，去了钟表馆和珍宝馆，觉得钟表馆更好看钟太精致了，主要本人怕人，身体欠佳，不然肯定多逛几处
38,K,3,2017-07-11 14:51:58,故宫（地址 北京东城区景山前街4号）
39,小庆,3,2017-07-10 17:13:03,北京这种景点人多的不行啊，而我对于这种只能在外边顺便看看又进不去的建筑实在不感兴趣，特别是天气热的时候，不建议去。
40,平头丽江哥,3,2017-07-09 19:48:10,国家的象征，标志性景点，必去。
41,珑璍紫煙,3,2017-07-09 18:41:12,大概是所有人北京游必去的景点，但期望越大失望越大，和全国各地省会城市的中心广场大同小异，去过之后肯定不会有再去第二次的欲望。
42,CantonVJ,3,2017-07-06 14:04:52,故宫博物院，旧称紫禁城，明清两代的皇宫，北京最有代表性的必去景点之一。但由于必去景点，每逢节假日暑期，人满为患……不想随着十万人随波逐流走马观花结果还不知道自己看了什么的话，租个语音讲解器还是有必要的，而且价格也不贵。游览线路就按讲解器上的走也行，如果时间有限，可以单纯逛逛核心的三大殿中轴线和几个大的寝宫，想拍照不被陌生人群包围的话，去一些相对偏僻的宫殿是较好的选择。
43,暴走的柯润娜,3,2017-06-21 17:39:05,庄严大气，现在的故宫比以前展览更多，更人性化更现代更具艺术气息了，这次比较吸引我的还有尚美珠宝展，很赞很干货
44,火星人Easyhoon,3,2017-06-16 03:40:36,故宫门票是真的良心，学生票只要20块！ 而且售票口很多，人多排队绝对不会超过20分钟。唯一可惜的就是不能进殿内参观，出了故宫一定要去爬下景山，从那上面俯瞰紫禁城是真的美！
45,琉璃夏,3,2017-06-13 15:57:44,真心不喜欢，我是小孩，所以可能不太喜欢历史，不过相对于一些大人应该是很喜欢
46,蚂蜂窝用户,3,2017-06-06 14:47:44,差点错过珍宝官，在找宁寿宫时才发现，也耽误了时间，强烈推荐
47,别爱我,3,2018-02-20 22:56:37,故宫周一开门吗？？？？？？？？？？？？
48,Yvonne早霞,3,2018-02-17 21:10:59,到故宫门口扫码购买电子票 很方便 直接刷身份证 就能进入参观 一定要有讲解 这样才能深入了解历史
49,窝窝,3,2018-01-21 19:35:42,一路走啊走，估计能走一下午，空荡荡、黑幽幽、冷……走出那刻看到了城墙那头站了一排排乌鸦、气氛压抑、沉重，你说，那里是不是有千年的怨气？
50,sunshine,3,2017-12-30 16:48:51,It’s good for me
51,小静哒哒哒,3,2017-12-20 13:20:16,It’s good for me
52,呦呵,3,2017-12-18 17:41:43,It’s good for me
53,小纯,3,2017-12-18 17:16:59,故宫 → 最大的感触就是 冷冰冰⁉️什么文物都没有，即使有也是只能在门口看两眼，然而故宫很多人，基本上两眼都很难看到🤭，真的很大，只开放三分之一，也要走上几小时，大殿那没有什么绿化，据说是因为安全问题，有树容易藏刺客🤔！最后有个小小的御花园，感觉也是平常，可能古装电视剧看多了，除了感受下这地方，也没啥了🐾
54,陌路风尘,3,2017-12-18 16:48:51,好的好的回电话简单机械锦绣江南继续继续那些那你
55,葛胖子,3,2017-12-14 13:35:36,一般般的，就是看建筑，里面没东西
56,只能勇敢╮,3,2017-12-14 09:57:30,跟妈妈一起去的，很多都不开放了
57,叔心的小六子,3,2017-12-01 11:16:21,喵喵喵？maiomaiaakakansbsjsnssn
58,我是你的girl,3,2017-11-16 16:52:00,想在故宫拍雪景，鹅毛大雪那种，推荐大概什么时间去？|･ω･｀)
59,diongdiong,3,2017-10-20 16:40:36,初次到北京，可以去看看，但不建议循环，个人感觉没什么意思。。。。
60,蚂蜂窝用户,3,2017-10-14 14:42:16,皇家宫殿 文化遗产 身为国人确实都该去看看 很大 要用两个小时来逛 还是有些宫不开 七月一号起全部是网上售票 扫码预定 要是计划要去的话 无论几点过去 建议先在网上买了票 不然到了也进不去 故宫一天貌似是限八万人次
61,董俏梅kira,3,2017-10-13 13:01:42,"有没有2017.8.4日或者到8.7日之间想要一起游北京城的呀，有的话请联系微信dddcherry,一个人想找个小伙伴喲"
62,ME游鱼儿,3,2017-08-02 17:04:32,听导游说故宫平时周一是闭馆的，只有七八月暑假之时周一才开放。在故宫，有很多人文历史，导游给每人配备了一个无线耳麦，给我们讲解故宫的人文历史。
63,沐阳先森,3,2017-08-01 17:35:19,说实话真的太一般了，而且从早到晚满满的人群也不利于去慢慢品味历史韵味，只有后面那个御花园还不错，里面有些沧桑的老树
64,Dinnnn,3,2017-07-27 21:30:58,开放的区域都没多大兴趣，而且殿内无法看清，大三重的人群隔开了
65,blue,3,2017-07-23 17:48:55,一般般，暑假人太多了。。。随便看看走了
66,aicey,3,2017-07-18 13:06:57,还不错哦，和家人一起来看的，想看好久了
67,蚂蜂窝用户,3,2017-07-18 12:17:26,暑假太热了，上午全是人在中轴线上，可能下午会好一些，实在走不动，所以中午就出来了，真的好大，理解为什么皇上出门要做轿子，去了钟表馆和珍宝馆，觉得钟表馆更好看钟太精致了，主要本人怕人，身体欠佳，不然肯定多逛几处
68,K,3,2017-07-11 14:51:58,故宫（地址 北京东城区景山前街4号）
69,小庆,3,2017-07-10 17:13:03,北京这种景点人多的不行啊，而我对于这种只能在外边顺便看看又进不去的建筑实在不感兴趣，特别是天气热的时候，不建议去。
70,平头丽江哥,3,2017-07-09 19:48:10,国家的象征，标志性景点，必去。
71,珑璍紫煙,3,2017-07-09 18:41:12,大概是所有人北京游必去的景点，但期望越大失望越大，和全国各地省会城市的中心广场大同小异，去过之后肯定不会有再去第二次的欲望。
72,CantonVJ,3,2017-07-06 14:04:52,故宫博物院，旧称紫禁城，明清两代的皇宫，北京最有代表性的必去景点之一。但由于必去景点，每逢节假日暑期，人满为患……不想随着十万人随波逐流走马观花结果还不知道自己看了什么的话，租个语音讲解器还是有必要的，而且价格也不贵。游览线路就按讲解器上的走也行，如果时间有限，可以单纯逛逛核心的三大殿中轴线和几个大的寝宫，想拍照不被陌生人群包围的话，去一些相对偏僻的宫殿是较好的选择。
73,暴走的柯润娜,3,2017-06-21 17:39:05,庄严大气，现在的故宫比以前展览更多，更人性化更现代更具艺术气息了，这次比较吸引我的还有尚美珠宝展，很赞很干货
74,火星人Easyhoon,3,2017-06-16 03:40:36,故宫门票是真的良心，学生票只要20块！ 而且售票口很多，人多排队绝对不会超过20分钟。唯一可惜的就是不能进殿内参观，出了故宫一定要去爬下景山，从那上面俯瞰紫禁城是真的美！
