,用户名,评论星级,评论时间,评论内容
0,Ginina,2,2019-11-01 15:24:46,别进去，路过看看就行，周边管制非常多，安检也非常麻烦。
1,浪漫骑士,1,2019-07-09 09:27:04,车多人多，空气质量差。一般游客人生不会选择再来的。
2,Aqua阿瓜,2,2019-03-14 19:11:54,我说这个地方不好玩会被叫喝茶吗....? 我调皮得试一下...这个景点非常经典，来北京肯定不能不去。整个国家的心脏。有浓浓的政治气息。走在路上就能感受出来。
3,乐乐,2,2018-11-14 14:59:36,首都北京，曾经住过一年，非常难忘。
4,虫草,2,2018-10-23 23:04:27,没什么特别的。还要走好长的路才穿过马路到对面哦
5,地平线,1,2018-07-28 12:35:38,啊啊啊啊啊啊啊啊啊啊啊啊啊，啊啊啊啊aaa
6,Misha,1,2018-05-07 04:54:42,周围卖五星红旗的人可能穷疯了，大家一定小心，看我们是女生好欺负 强行卖给我们 我们不买还骂我们，太可怕了 我说报警还要来打我 警察都不怕了
7,xingyunstar,2,2019-09-15 08:05:22,节假日千万不要去 节假日千万不要去节假日千万不要去节假日千万不要去节假日千万不要去
8,面包里的葡萄干,2,2018-05-02 09:38:40,天安门上的人，真是可以说是用人山人海来形容了，人流一直不断，若不是因为是中国的地标性建筑，真是能别去就别去吧，恰逢毛主席纪念堂还闭馆装修，真是啥好都没碰上。去城楼的门票需要进去之后再买，15块钱，学生证5块，65岁以上老人不要钱，进去城楼上要存包一定要记得，不然买了票也进不去，水什么的也不准带上去，上去以后能看到天安门前广场的俯瞰景色，感觉还不错，城楼里面是不许拍照的，有城楼百年的变迁，可以看看，参观城楼安检排队15分钟，走过天安门广场用了差不多40分钟，买票排队半个小时，存包排队15分钟，进去参观20分钟不到，有些失望。。全部都是人
9,我行我素,1,2017-08-17 15:19:51,现在进出貌似还要安检 广场上遍布着各种各样的便衣 除了人没别的
10,玉玉,2,2016-05-11 13:24:07,人真的太多了。年纪大的朋友不要去。
11,果冻,2,2016-04-10 05:09:55,人多，全是人，其实就是一个北京的标志。。。
12,秋天de白菜,2,2016-02-29 10:43:48,似乎来北京旅游都得去天安门，个人觉得天安门值得看的是升降旗仪式。
13,avaのstrong,2,2016-02-15 16:02:43,看升旗，好多人，也就几分钟，不过值得看一次，很庄严
14,Richard,2,2016-02-12 18:02:07,对于这里呢，我真的不想说太多了。有什么可看的？不明白了。安检严格的不行，人也多的不行。早上要是想看升旗找个好位置，凌晨3点到都不一定能找到合适的位置！逢年过节的，人多的不行，人挨人，人挤人的，什么都看不了。周边只能做地铁或是公交车，打车根本不停，你得走出两公里才行。反正真的没什么可看的，没有可玩的，没什么景色可拍的。要是时间挺紧的，最好让司机走长安街路过看一眼就好了，别特意来了，浪费时间，还不如去别的景点多玩玩呢
15,一梦三十年,2,2016-02-10 10:02:45,看升旗是个很受罪的活，大半夜冻的半死等到天亮，人海茫茫全是人头，基本也就看个旗杆，不推荐休闲旅行者。自虐打卡型可以去一次。
16,北京小老虎,1,2017-06-14 23:11:40,安检太严，根本进不去。雾霾太大，啥也看不见。
17,青烟沐阳,1,2016-02-02 23:13:19,一般般，没意思，但是为了表现还是可以去。旁边是故宫
18,贺晋英,1,2015-12-11 11:13:39,一个令全球任何人向往，神秘的地方
19,Kathleen,2,2015-11-22 19:05:27,我倒想找个人告诉我，有什么好看的，有什么好看的，有什么好看的！！
20,光辉,2,2015-11-11 20:01:46,中国 北京 天安门 这还用多说么
21,硕硕的U盘,2,2015-10-12 10:02:49,有意思吗？就是个广场，到此一游足够了
22,MJ23mj,2,2015-09-24 22:22:14,人多车多，总有人监视你，进去要安检搜身，天黑了要赶人清场，白天太阳大，降了个半旗
23,泥伯公,2,2015-09-12 11:46:19,安检非常严格，没有意思了，中间那个新建筑很碍事，影响景观！
24,Brentcor,2,2015-09-12 02:34:03,来这里除了看一下年年翻新年年新的门以外，最大的风景是满街的警察，安全系数还挺高的吧，如果没带暂住证和穿的不整齐，奉劝你不要过来，不然到时候拉到三间房去筛了沙子，可别怪我没提醒你
25,SOMEBODY,1,2015-08-29 00:11:59,一个政治色彩很浓的地方，一片大空地，没有特别的
26,pb0911013,2,2015-08-17 09:27:22,"没什么看头的广场,就很空的一块地"
27,隔壁的kouby,2,2015-08-11 14:14:17,虽然去过天安门广场很多次了，但每次去都还是会觉得很庄严肃穆，有一种国家象征的感觉
28,Wangming,2,2015-08-04 01:17:24,无聊透顶丝毫没有意义，不建议去
29,岫岫,2,2015-07-26 10:25:08,天安门人很多，排队进去之后拍了一下天安门就进去了，里面可以登城楼，要买票，买完票还要去存包，城楼不能带包上去，存包还要交钱。真是各种无语。其实城楼上面也没啥好看的。
30,夏立未满,1,2015-07-23 19:49:21,安防很严，每次路过就很好奇为啥那么多人喜欢去那里拍照。完全没有任何景致可看。
31,光芒盛夏,2,2015-07-09 21:26:20,人居多 毛主席纪念堂 很威严 人民英雄纪念碑站岗的英姿飒爽啊 天安门周围的城墙到是蛮有意思，厕所太差了。。。
32,大_杨洋,1,2014-08-18 13:42:04,北京去了得有不下8次了，除了路过这，什么故宫、长城、后海啥的，哪里都没去。
33,Elisha,2,2014-08-16 13:29:20,初到北京基本上都会去看看，反正第二次也不会再去了。公厕等公共设施真心差，工作人员态度也不好，实在是很坍国人的台。。
34,二十三笔画,1,2014-08-08 10:21:35,每天的人很多，门票100元，里面的景色不错，不愧为皇家园林，非常的不错。
35,莱西,1,2014-08-07 12:08:35,在天安门前升国旗的人山人海，最好不要节假日去，否则你只能看人头攒动了
36,江 宏明,1,2014-08-04 22:13:05,我爱北京天安门，天安门，中华人民共和国的象征。坐落在中华人民共和国的首都----北京市的中心，故宫的南端，与天安门广场隔长安街相望，是明清两代北京皇城的正门。设计者为明代的御用建筑匠师蒯（kuai）祥。
37,〆、LoveStory,1,2014-08-02 22:30:20,人真的太多了~~我是暑假去的。。。。可能是暑假，又热人又多，反正没什么心思去膜拜了- -
38,放松自己,1,2014-08-01 11:52:16,天天人满，没意思！天天人满，没意思！天天人满，没意思！天天人满，没意思！天天人满，没意思！天天人满，没意思！
39,在穗农民公,1,2014-07-31 20:56:10,为何，这里会成为中心！我们的党、我们的开国功勋、元帅们，是否也相信国运国格国势呢！
40,空濂居士,1,2014-07-31 14:33:12,瞻仰人民英雄纪念碑，环顾天安门、人民大会堂、国家博物馆、毛主席纪念堂...天子脚下，气势磅礴，午门之内，实乃霸气！
41,肥牛,2,2014-07-28 12:59:09,人真多，天热，挤得慌，拍照都要等半天，不知道一个广场有虾米好逛的
42,mtdfw,1,2014-07-19 21:05:10,北京出了空气不好，其他都美，2012和2013都是5月份来的，天气适宜，没什么风尘暴。
43,Veron,2,2014-07-17 09:00:38,四岁的时候爸妈带着去过一次 完全没有现在那么多人啊~ 去年带着小妞又去了一次 人山人海 人山人海 我想着我干嘛就在十一这个时候来了北京呢。。。。。。
44,雨中蓝荷,1,2014-07-12 20:12:33,这貌似是去故宫必经过的吧，人一如既往的多，不需要门票，很高大上的一建筑！
45,sugarjenny,1,2014-07-10 13:20:20,不喜欢北京，这里没有美景，只有雾霾、干燥的天气，比起南方差远了。
46,天生我才,2,2014-07-09 10:43:36,首都的骄傲 中华的象征 历史的见证 顶尖的建筑
47,奔跑的small玲仔,2,2015-06-09 19:36:16,之前只在电视里面天天看到，感觉好威武好雄壮的说。到了才发现，要不要真么坑爹，破旧不说吧，一点都不高大，我们祖国的中心有好好维护吗
48,fw喵,2,2015-04-03 11:17:00,赶上两会，进个广场还排队安检，进去逛的时间没有排队长。去一次意思下就好
49,新围仔,2,2015-03-24 15:35:02,真的有几万人看升旗啊啊啊，人挤人人挤人，去一次就不想去了
50,生命,1,2015-03-19 23:35:16,特色也算是特色，不过这玩意总有一天得大变样
51,泠泠夏末雨,2,2015-03-03 21:46:05,也就是那个样子吧，人太多了，不过也正常人挤人挤死人...不过往往等了大半夜之后来看升旗，心里面还是有种满足感的。
52,Bella,2,2015-02-06 09:20:49,没想到下午三点半以后博物馆就停止售票了，我们正好被锁在了栏杆外，又错过！满心惆怅啊！无可奈何，只能在天安门广场转转。拍拍这里，拍拍那里。。。不过这鬼天气，生生把个气势雄伟的人民英雄纪念碑给弄成了一副昏昏惨惨的样子。
53,竹林弄琴,1,2015-01-25 13:04:15,2002年的天安门，我是怀着无比敬仰的心情前去，第一次亲眼看到天安门，还是小小激动了一下下呢！2014年我坐着车走在长安街上，日益高耸的现代建筑，让天安门在海拔上没有了优势，可在我的心中，他依旧那样圣洁！
54,红莲,1,2015-01-23 17:26:12,六岁，第一次见识大千世界。从此，在我心中，只有雄伟的天安门和辽阔的天安门广场才能代表北京，今天日新月异的发展，只能说明它是一个现代化的城市。
55,听海人家,2,2015-01-12 16:31:54,记得那天三点多就起来了，四点钟集合去看，结果到了那边，那叫一个人多，根本看不到，看来想亲眼目睹这庄严神圣的升旗仪式，估计得在天安门广场这边连夜坐等了
56,tianyucp,2,2015-01-07 16:22:39,世界上最大的广场，景色一般吧。参观过一次升旗仪式，再也不回去了
57,我是民工,2,2014-12-31 12:56:23,国家的象征吧。外地来京很少不去天安门看看的
58,iq101eq101,2,2014-12-15 15:38:59,拍照地点！旅游大巴必须到的地方！所以说是到北京必去的景点，地方很大，如果能挑到“好天气”没有雾霾的时候拜访还是挺值得的！
59,MiMi,1,2014-12-04 06:03:29,天安门是每个国人(ˇ欧ˇ） 想～去的，我没有那个毅力很早爬起来去看升国旗，只有在大上午的去逛逛。
60,夏立未满,1,2014-11-19 15:22:04,安防很严，每次路过就很好奇为啥那么多人喜欢去那里拍照。完全没有任何景致可看。
61,光芒盛夏,2,2014-11-19 06:54:21,人居多 毛主席纪念堂 很威严 人民英雄纪念碑站岗的英姿飒爽啊 天安门周围的城墙到是蛮有意思，厕所太差了。。。
62,大_杨洋,1,2014-08-18 13:42:04,北京去了得有不下8次了，除了路过这，什么故宫、长城、后海啥的，哪里都没去。
63,Elisha,2,2014-08-16 13:29:20,初到北京基本上都会去看看，反正第二次也不会再去了。公厕等公共设施真心差，工作人员态度也不好，实在是很坍国人的台。。
64,二十三笔画,1,2014-08-08 10:21:35,每天的人很多，门票100元，里面的景色不错，不愧为皇家园林，非常的不错。
65,莱西,1,2014-08-07 12:08:35,在天安门前升国旗的人山人海，最好不要节假日去，否则你只能看人头攒动了
66,江 宏明,1,2014-08-04 22:13:05,我爱北京天安门，天安门，中华人民共和国的象征。坐落在中华人民共和国的首都----北京市的中心，故宫的南端，与天安门广场隔长安街相望，是明清两代北京皇城的正门。设计者为明代的御用建筑匠师蒯（kuai）祥。
67,〆、LoveStory,1,2014-08-02 22:30:20,人真的太多了~~我是暑假去的。。。。可能是暑假，又热人又多，反正没什么心思去膜拜了- -
68,放松自己,1,2014-08-01 11:52:16,天天人满，没意思！天天人满，没意思！天天人满，没意思！天天人满，没意思！天天人满，没意思！天天人满，没意思！
69,在穗农民公,1,2014-07-31 20:56:10,为何，这里会成为中心！我们的党、我们的开国功勋、元帅们，是否也相信国运国格国势呢！
70,空濂居士,1,2014-07-31 14:33:12,瞻仰人民英雄纪念碑，环顾天安门、人民大会堂、国家博物馆、毛主席纪念堂...天子脚下，气势磅礴，午门之内，实乃霸气！
71,肥牛,2,2014-07-28 12:59:09,人真多，天热，挤得慌，拍照都要等半天，不知道一个广场有虾米好逛的
72,mtdfw,1,2014-07-19 21:05:10,北京出了空气不好，其他都美，2012和2013都是5月份来的，天气适宜，没什么风尘暴。
73,Veron,2,2014-07-17 09:00:38,四岁的时候爸妈带着去过一次 完全没有现在那么多人啊~ 去年带着小妞又去了一次 人山人海 人山人海 我想着我干嘛就在十一这个时候来了北京呢。。。。。。
74,雨中蓝荷,1,2014-07-12 20:12:33,这貌似是去故宫必经过的吧，人一如既往的多，不需要门票，很高大上的一建筑！
