,用户名,评论星级,评论时间,评论内容
56,___乐天知命,5,2019-04-04 01:33:22,华山真的很险，我们办理的是西上北下，从西峰上北峰下，时间有一些紧张，我们到达华山的时候已经是中午大约12点多，所以给我们的时间并不是很充裕，去爬满东南西北中五个峰，所以很遗憾没有爬到中峰上面，因为时间不够了。到达长空栈道的时候，长空栈道也因为不知道什么原因所以没有开放，没有爬到也是一个不小的遗憾。华山真的很高很险，我从山上下来的时候整个两条腿都在抖，推头的原因可能是因为山比较高，也可能是因为走了比较远的路，所以推荐大家上山的时候备一些吃的和红牛一类的功能饮料，建议大家爬山的时候穿一双比较舒适的运动鞋，而且鞋面不是特别容易划破的那种，是下雨天的话，还是比较建议大家购买防滑手套的，铁链在沾上水以后还是比较滑的，大家也可以购买登山杖，用来辅助自己登山下山，我体力不是太好的话，建议大家选择西峰西上西下，或者北峰北上北下。如果那家是外地人的话，还是比较建议从旅行社报华山一日游，也可以从网上直接预订，网上购买的话，送的东西比较多，手套，登山杖，水之类的东西都是由网络上订的旅行社来负责赠送的
57,國殤,5,2019-04-02 11:32:03,怎么说呢？第一次去的话到中间肯定会后悔，因为路上好多骗子。说是马上就到其实还有好远好远，反正上去至少需要6个小时。上去之后你会发现挺好的，等到太阳慢慢出来你就会发现真TM值。漂亮的不要不要的，下来的时候感觉腿都已经不是自己的了。不过想想的确很漂亮，时至今日有机会还会再去一次，好了我该起床了。这个梦很真实
58,ekship,5,2019-03-31 22:19:03,华山风景区是国内最美的山岳之一，景区建设得很成熟，配套齐全。
59,旅行达人梦男,5,2019-03-21 20:02:51,华山简直就是鬼斧神工，去的时候天气很热，景色特别美，非常险
60,知秋,5,2019-03-11 20:03:07,险峻华山，五岳最险，很值得去体会一次！
61,独孤求败,5,2018-11-07 22:44:45,西岳化身，奇险务必 山顶风光无限好，只要你运气好
62,猪猪,5,2019-10-19 11:51:56,美到极致！云海，山峰，飞鸟，丛林……大自然真的太伟大了！
63,ZHRUN,5,2019-08-15 13:37:37,华山真的很美，宛如仙境实至名归。天气好的时候，清晨的华山是山肩云雾缭绕，山峰视野开阔，站在峰顶，犹如置身于云山雾海之中，一个个山头就像从海里突出的石礁，在雾浪里时隐时现。华山真的很险。想真正体验华山，深度了解华山，建议从“自古华山一条路”徒步上山和下山。路上的“千尺幢”、“百尺峡”、“老君犁沟”、“苍龙岭”接踵而至，让爬山者在累之中感受着险，深切感受到，“山穷水复疑无路”，“柳暗花明”更无村。但这一切的感受，不论是痛是美，都让你在离开华山之后同样的怀念。对于想感受华山的美的一点个人建议：美景包括但不限于东峰的日出，西峰的日落和清晨的云雾缭绕，云台峰的华山“龙脉”对于想感受华山的险的一点个人建议：险胜包括但不限于“千尺幢”、“百尺峡”、“老君犁沟”、“苍龙岭”、“天梯”、“云梯”对于向深度体验华山的路线建议：第一天：1 自古华山一条路至北峰 - 2 徒步至 西峰看日落第二天：3 早晨从西峰去东峰看日出 - 4 转中峰 - 5 至南峰 - 6 到西峰 - 7 下北峰 - 8 智取华山路下山注：1. 自古华山一条路上的著名景点 “千尺幢”、“百尺峡”、“老君犁沟”都可以体验到，同时路上的景色也都能较为细致的感受到，此段路程可边走边玩边拍照，体力要求较低，适合爬山刚开始的热身；到北峰了大致在下午1点多，可以休整一下，在“华山论剑”碑前拍照留念（华山有很多“论剑”碑，只有北峰上的是官方宣传的2. 从北峰徒步至西峰，可以体验到“擦耳崖”，“苍龙岭”，“金锁关”等景点，“天梯”也是在这段路上；这段路上经常有大妈和年轻小哥互唱山歌，气氛很是活泼；边走边玩，到西峰差不多5、6点，可以赶上春夏季节的日落了（一般在7点左右）3. 东峰日出一般在6点左右，从西峰至东峰一般要30～40分钟，大家可以按自己速度安排起床时间；看完日出，可以顺便玩个“鹞子翻身”（这里也可以直接赶去“长空栈道”，那里常常排很长的队；我去的时候“长空栈道”在检修，所有我们就成了当天“鹞子翻身”的第一批游客4. 中锋其实更像是东峰旁边的一个小峰，因为几乎是连在一起的，很多人分不清两者，也因为离得近，中锋的景色被东峰大为限制5. 南峰有着华山第一险“长空栈道”，同时峰顶有着所有峰最为开阔的视野，景色甚是美丽6. 赶去西峰的时候应该是早上10点左右了，这个时候西峰会再现宝莲灯里的美景
64,爱仔,5,2019-07-27 01:10:54,一天爬完华山4个峰，第二天脚杆打闪闪的感觉难以忘怀。
65,小猪猪侠,5,2019-07-20 17:26:25,华山这个地方一定要来下，是五月中最最俊美险要的一个。
66,苏姐,5,2019-07-05 14:26:27,20190414来到华山只买了门票，北峰北上北下全程徒步，用时5个小时。景色优美，运动量刚刚好。赞赞赞！
67,深川Germanotta,5,2019-06-20 12:23:53,看日出，第四个观日台再往前走不到100米的鹞子翻身也是一个看日出非常棒的地方而且有两层前低后高，不像其他观日台前高后低后面的人都看不到。
68,catherine,4,2019-06-15 15:56:50,西岳华山自古以险著称，这次见证了金庸笔下的华山风貌，恍如置身华山论剑的场景当中
69,New Diana,5,2019-05-17 22:54:27,只有一天时间，选择北上西下（均索道，西上北下更省力），索道北上10min，西下20min，西下的索道要翻过几座山，cool。北峰到中锋需要2h，陆续到东峰、南峰、西峰就很近了。东峰鹞子翻身、南峰长空栈道项目较慢，均需要排队1-2h，不过确实刺激独特，各地点的合影拍照请还价。想看日出的还是需要夜爬华山（晚上10点左右开始），或者在山上提前住一宿。根据情况自带零食、水果、饮水、手套等。选择华山一条路爬上去的话需要4h，斟酌体力和时间安排，避免后续各山峰无力游览。ps，出行由西安北高铁到华山，出站有免费大巴拉到售票处，可提前某团购买各种票。离开时切记不要坐大巴回西安，太坑，除非就差一俩人就满员，否则有得等了，更不能相信这群奸商的5min发车，我们苦逼的返回西安花了3个多小时。高铁时间合适的话，免费大巴回火车站高铁回西安最安逸。
70,马蜂窝用户,5,2019-07-24 12:06:03,08年十一月一个人爬了一次，感觉不过瘾，十二月又去爬了一次，长空栈道就我一个人，好爽！
71,马蜂窝用户,5,2019-07-27 17:12:33,很不错的一个圣地，就是体力文体爬的有点累
72,蚂蜂窝用户,5,2019-05-16 21:53:53,华阴给来爬华山的游客的福利—市内有免费班车到华山售票处。大家记住去的时候在哪儿下的车，回来也在哪儿上车。千万别在门口的路牌下傻等。
73,摄影师【四哥】,5,2019-05-11 21:34:22,建议先去其他几个，最后登它，因为最有意思吧
74,文墨,5,2019-05-10 00:49:37,早上9：30起，顺着自古华山一条，西门开始，北峰、南峰、东峰、中峰，最后到达西峰看日落，坐上缆车，飘飘荡荡下来；爬的慢，走走停停，山景无限好，基本都优于我之前爬的每一座山峰，特别是险峻——苍龙岭、千尺幢、百尺峡等等，仅华山二险——鹞子翻身、长空栈道太过惊险而未做体验，各险峻处，风光更绝，峭壁千尺，绿树厅石；特别美好的一次爬山体验。
