,用户名,评论星级,评论时间,评论内容
22,Aries,5,2019-01-13 20:27:41, 刚到华山游客中心，远看华山并没有令我惊奇，对于从小生活在大山里的我来说，华山真的不算高，可是当到山里的时候，看到华山的巍峨气派，整个人都被惊呆了！一条条许愿带承载着的是一个个游客的美好心愿，一把把同心锁见证的是一对对情侣的美好爱情！这成了华山上另一道美丽的风景。奇险天下第一山，华山的确很多地方几乎成九十度，当然有些90度的路不是必经之路，看个人体力行走吧。我们从北峰经中锋、东峰、南峰到达西峰。关于华山论剑的标准游客照，华山论剑的标志真的整个华山到处都是，所以人多的时候就没有必要过去合影了。我们去的前一天华山下过雪，所以山上还能看到很多积雪，有些地方结冰了，有点滑，所以这个季节去华山鞋子一定要防滑。我们边玩边爬，到西峰的时候已经是下午四点左右了，在西峰休息了一会儿就下山了，由于时间关系，没在西峰等日落有点遗憾，但是，华山的景色依然让我流连忘返。补充一下，西峰索道下山，有个滑道特别好玩，还想再去坐一次。
23,苏叶_,5,2019-01-12 17:30:22,自己去华山还要购买动车票，再打车，费时又费力，还不如一日游来的省力。我们当时订的是只含车导和门票的，索道费用可以在车上再跟导游补的。华山一日游的项目大部分只有西上北下，西上西下，北上北下的。但我们当时做攻略的时候，好多都推荐北上西下最经典，后来就拜托导游给我们单独去买了北上西下的索道票。到了华山景点之后，距离索道还是有一段距离的，所以你需要购买一个索道巴士。北峰索道巴士：20元/人（20分钟车程），西峰索道巴士：40元/人（45分钟车程）索道费用：北峰索道80元/人（15分钟左右），西峰索道：160元/人（25分钟左右），还有一个华山的专属保险10元/人。总共算下来，包括一日游费用，一趟华山行程，大概需要498元/人。科普一下华山内容，这样你们出行的时候也可以考虑怎么上山。华山一共是五个峰，北峰，东峰，中峰，南峰，西峰，其中北峰最矮（海拔1614米），南峰最高（海拔2160.8米），西峰风景最美，东峰有“鹞子翻身”，南峰有“长空栈道”（导游介绍栈道项目是要排队的，一般要排1-2个小时....）北上北下和西上西下相对比较轻松一点，体力一般的可以选着这两个，西上北下年轻的小伙子们可以拼一拼了，而北上西下是最累的.....北峰上去是最陡的一段上路，几乎是90度台阶，每个台阶还都非常窄，恐高的我真的是拼了老命，没敢回头往下看，但是登顶之后，心情真的会非常棒了。
24,DONNY*SHEI,5,2019-01-08 13:51:51,到达山脚下的时候就感受到了华山的奇和险。山下的宝鼎则更显示出华山气势磅礴。东峰向北峰走，是下山的必经之路，各种提示标语都有，不会让大家迷路，其中一条写的比较中肯，那就是下山别拍照，拍照别下山。缆车中的华山让我更近一步的体验到它魅力所在。华山的山石在历史与自然的冲涮和沉积中，完美的雕琢出它雄浑大气的一面。
25,艳仔仔Sherien,5,2018-12-30 18:25:22,我们9月30号到西安，10月1日爬华山，假期最开始第一天人极少。后几天在朋友圈看朋友上华山拍的照片，就是大家所熟悉的人从众调调了。大部分人会选择西上北下，我们选择北上西下。我们坐7点的火车，大约8点到华山游客中心，我们晚上5点的火车回西安，全程游览完毕，身体没有很累，时间没有很紧，游览一天感觉刚刚好。说实话，作为一个跑完多个半马体力还算阔以的小姐姐，后面的东西南北中群山连环爬也是累的够呛。上山的路风景也许很美，靠自己一步一个脚印将华山踩在脚下也许成就感很强。但你怎知在索道里看到的风景不是鬼斧神工触碰心灵，体力充沛的去欣赏风景不是自由自在随意畅快。只有一天时间的人，我建议还是双索道上下行把，登山杖和手套对索道上下行的人，无所谓，用不了几次。华山上好吃的种类繁多品质齐全供您挑选，只要你有钱。溢价基本在4倍左右。我们是全程带吃的——牛肉干、巧克力、面包、玉米肠、水果、各种零食。水果最棒，爬累了吃点橘子苹果啥的好爽！从十月一温度来看，一件单衣加外套足以。白天山上温度没有很低，日晒比较强。 几点建议：防晒霜带着经常涂，日晒很强，墨镜要备着一副，摩擦力大的鞋子，好多地方是石头凿刻的阶梯有些滑，走路不看景，注意安全，华山有点险。你说规规矩矩朝九晚五的生活好不好，日复一日的是没什么意思，却是很多被迫奔波的人梦想过的安稳生活，不敢不知足。西风为马落雨为笛的潇洒人生大概在二十岁年纪的梦里，今天趁着阳光大好，华山的风与落石陪我走一遭。爬了没多少就来到山顶，山顶的路基本是石头凿刻出来的，两边挂着铁索，北峰上山之后基本上就只有一条路，到中锋、东峰的就沿着路走好了，我记得一对情侣和我们一样上的索道，结果北峰顶遇到一次，前后脚又到中锋，东峰爬上去又看见这两人你侬我侬，也算成就华山奇缘。华山真是奇险，很多地方需要手脚并用往上爬。反正一切以安全为主，形象为辅，装逼乃最下策。
26,chrisnow,5,2018-12-19 11:14:18,华山景区售票厅前就有停车场，停好车去大厅买票。因为是假期，售票大厅排队买票的人好多，毕竟是成熟的旅游景点，大厅就有专门的网络购票的取票窗口，决定还是在网上买票，买的是套票，价格454元，含门票、来回大巴票、西峰和北峰索道票，门票可以2天重复入园，西峰索道票也是2天的有效期，但是不能重复使用，方便夜游华山的游客使用。网络票确认也很快，直接在窗口取了全部票，就排队坐大巴开始一天的游山之旅。我们是从北峰上西峰下，有两个原因，一方面错开些人流，减少排队等待的时间，另一方面，像比较险的苍龙岭、千尺幢、百尺峡，我更喜欢向上爬的感觉，回头俯视来路，更有一番意境。我们的游览顺序是北峰（峰顶有华山论剑的石刻）(东峰（鹞子翻身，观日出也是在东峰）(中峰（玉女祠、无根树）(南峰（华山最高峰，峰顶有海拔高度的石刻，长空栈道需要排队，每次只能10人，往返大概半小时）(西峰（莲花峰，两次爬华山都没上去，只远眺了一下），因为假期游览的人太多，看峰顶都是人头攒动的，所以没有到达南峰和西峰顶，从西峰索道直接下山。
27,超重的棉花,5,2018-12-07 01:21:36,做过爬华山攻略的人都知道爬华山有以下几种方式：1. 体力最差的：西峰索道上，北峰索道下。因为西峰比北峰高，所以走的路以下台阶为主。2. 体力很差的：北峰索道上，西峰索道下。这样有点爬山的感觉，又不会太累。3. 体力较差者：西峰索道上，自古华山一条路下，可以走过所有景点，全程下坡。4. 体力较好者：自古华山一条路上，西峰索道下，有爬山的感觉，不走回头路。5. 体力强悍的：自古华山一条路上，北峰索道下，到西峰后回头再回北峰索道，好处是北峰索道的价格要优惠很多。6. 终极累死狗的：自古华山一条路上，智取华山路下。 我的向往最后一个模式，选择全程步行！无数的游记都说华山五峰，爬至北峰就需要3.5到4个小时左右的时间。9点40分，我站在山脚下，计时开始。沿途见到了年逾古稀的长者挑着水前行，遇到情侣牵手说笑攀爬，看到前日夜爬的青年下山，近处满山红叶，远处白雪皑皑，溪水在山间流淌。华山不愧为天下第一奇险，众人唯有四肢协力，才能“爬”山！12点20分，我已经登上了北峰，比平均水平快了1个多小时，心中窃喜，怕华山没有此前想象的那么恐怖。告别北峰，继续前行，而爬山也变得更加的艰难了。苍龙岭被奉为华山三险之一，我手脚并用，爬完这一程，差点儿把自己感动地泣不成声。本以为越过一道道坎坷，一切都会变得越来美好，事实证明自己太天真了。路面湿滑，步履维艰，之前因为快步爬山的热血沸腾早已被山上的冰雪稀释，再次手脚冰凉。许久之后，穿过金锁关，我终于来到东西中南峰的岔路上。中峰景致甚少，匆匆走过，便来到东峰，久闻东峰最美，适合观赏日出，可是我不喜欢夜爬，总觉得夜晚爬山会错过周围风景。站在东峰，环顾四周，觉得此前的一切努力值得！休息后再爬南峰，在南峰欣赏了落日晚霞。18点半游览了西峰后，我们乘坐着亚洲第一索道，历时18分钟，跨越四千余米，成功着陆，一切都如梦一般。
28,狄道布衣,5,2018-12-03 23:59:27,华山，天下有名，景好，但山上的工作人员的态度不咋的。那次，上山，在山上刚好碰见有个姑娘问工作人员，那条路下山平一些，可是，他们竟然回答说，高速公路平，那态度太让人气愤了。或许，是个个例，但真的不舒服。
29,郑大大大娜,5,2018-12-03 15:56:42,都说华山很险特别是下过雪后的真的有点危险，因为山很陡然后路很滑，每走一步都是小心翼翼的，所以这次旅行华山是我最刺激的一站了。因为害怕会很冷我还租了件大衣，事实也证明没租错哈哈，二十块钱的大衣一点也不冷，上去还是可以带多一点零食，因为上面物价比较高…上山很容易，因为是坐了缆车…很长的缆车，感觉坐了好长时间哈哈哈，山上很壮观…很宏伟…很值得一来。我心心念念许久的的长空棧道…超级无敌刺激。华山很棒，是有生之年必须去的景点之一，但是如果有恐高的人就建议不要去了…分分钟会脚软。冬季去上面还是有点冷的，大衣还是要的，在排队等待时就硬生生吹了两个小时的冷风。然后这次也体验了华山夜晚的的刺激…因为出来之后一下子跟不上大部队了，一下子感觉都没人了（所以重点提示最好不要一个人，不要落单了…要不然一个人下山四个小时会吓死的诶），最好多约几个小伙伴或者驴友去爬哦。人多总会热闹一些，有一段山路几乎是垂直地面的，反正感觉真的超值，好开心哦，下山下了四五个小时，不一样的体验。最后建议最好就住在山脚下啦，下了山刚好回青旅真的挺方便的，然后要戴手套和穿防滑一点的鞋子…
30,知秋,5,2018-12-02 13:28:58,险峻华山，五岳最险，很值得去体会一次！
31,独孤求败,5,2018-11-30 21:58:22,西岳化身，奇险务必 山顶风光无限好，只要你运气好
32,猪猪,5,2018-11-23 21:23:20,美到极致！云海，山峰，飞鸟，丛林……大自然真的太伟大了！
33,ZHRUN,5,2018-11-23 17:19:31,华山真的很美，宛如仙境实至名归。天气好的时候，清晨的华山是山肩云雾缭绕，山峰视野开阔，站在峰顶，犹如置身于云山雾海之中，一个个山头就像从海里突出的石礁，在雾浪里时隐时现。华山真的很险。想真正体验华山，深度了解华山，建议从“自古华山一条路”徒步上山和下山。路上的“千尺幢”、“百尺峡”、“老君犁沟”、“苍龙岭”接踵而至，让爬山者在累之中感受着险，深切感受到，“山穷水复疑无路”，“柳暗花明”更无村。但这一切的感受，不论是痛是美，都让你在离开华山之后同样的怀念。对于想感受华山的美的一点个人建议：美景包括但不限于东峰的日出，西峰的日落和清晨的云雾缭绕，云台峰的华山“龙脉”对于想感受华山的险的一点个人建议：险胜包括但不限于“千尺幢”、“百尺峡”、“老君犁沟”、“苍龙岭”、“天梯”、“云梯”对于向深度体验华山的路线建议：第一天：1 自古华山一条路至北峰 - 2 徒步至 西峰看日落第二天：3 早晨从西峰去东峰看日出 - 4 转中峰 - 5 至南峰 - 6 到西峰 - 7 下北峰 - 8 智取华山路下山注：1. 自古华山一条路上的著名景点 “千尺幢”、“百尺峡”、“老君犁沟”都可以体验到，同时路上的景色也都能较为细致的感受到，此段路程可边走边玩边拍照，体力要求较低，适合爬山刚开始的热身；到北峰了大致在下午1点多，可以休整一下，在“华山论剑”碑前拍照留念（华山有很多“论剑”碑，只有北峰上的是官方宣传的2. 从北峰徒步至西峰，可以体验到“擦耳崖”，“苍龙岭”，“金锁关”等景点，“天梯”也是在这段路上；这段路上经常有大妈和年轻小哥互唱山歌，气氛很是活泼；边走边玩，到西峰差不多5、6点，可以赶上春夏季节的日落了（一般在7点左右）3. 东峰日出一般在6点左右，从西峰至东峰一般要30～40分钟，大家可以按自己速度安排起床时间；看完日出，可以顺便玩个“鹞子翻身”（这里也可以直接赶去“长空栈道”，那里常常排很长的队；我去的时候“长空栈道”在检修，所有我们就成了当天“鹞子翻身”的第一批游客4. 中锋其实更像是东峰旁边的一个小峰，因为几乎是连在一起的，很多人分不清两者，也因为离得近，中锋的景色被东峰大为限制5. 南峰有着华山第一险“长空栈道”，同时峰顶有着所有峰最为开阔的视野，景色甚是美丽6. 赶去西峰的时候应该是早上10点左右了，这个时候西峰会再现宝莲灯里的美景
34,爱仔,5,2018-11-22 21:57:41,一天爬完华山4个峰，第二天脚杆打闪闪的感觉难以忘怀。
35,小猪猪侠,5,2018-11-21 22:45:50,华山这个地方一定要来下，是五月中最最俊美险要的一个。
36,苏姐,5,2020-02-15 14:46:09,20190414来到华山只买了门票，北峰北上北下全程徒步，用时5个小时。景色优美，运动量刚刚好。赞赞赞！
37,深川Germanotta,5,2018-11-20 22:35:03,看日出，第四个观日台再往前走不到100米的鹞子翻身也是一个看日出非常棒的地方而且有两层前低后高，不像其他观日台前高后低后面的人都看不到。
38,catherine,4,2020-05-30 17:38:07,西岳华山自古以险著称，这次见证了金庸笔下的华山风貌，恍如置身华山论剑的场景当中
39,New Diana,5,2020-06-09 00:31:24,只有一天时间，选择北上西下（均索道，西上北下更省力），索道北上10min，西下20min，西下的索道要翻过几座山，cool。北峰到中锋需要2h，陆续到东峰、南峰、西峰就很近了。东峰鹞子翻身、南峰长空栈道项目较慢，均需要排队1-2h，不过确实刺激独特，各地点的合影拍照请还价。想看日出的还是需要夜爬华山（晚上10点左右开始），或者在山上提前住一宿。根据情况自带零食、水果、饮水、手套等。选择华山一条路爬上去的话需要4h，斟酌体力和时间安排，避免后续各山峰无力游览。ps，出行由西安北高铁到华山，出站有免费大巴拉到售票处，可提前某团购买各种票。离开时切记不要坐大巴回西安，太坑，除非就差一俩人就满员，否则有得等了，更不能相信这群奸商的5min发车，我们苦逼的返回西安花了3个多小时。高铁时间合适的话，免费大巴回火车站高铁回西安最安逸。
40,马蜂窝用户,5,2018-11-17 09:32:03,08年十一月一个人爬了一次，感觉不过瘾，十二月又去爬了一次，长空栈道就我一个人，好爽！
41,马蜂窝用户,5,2018-11-15 20:39:50,很不错的一个圣地，就是体力文体爬的有点累
42,蚂蜂窝用户,5,2018-11-10 14:20:29,华阴给来爬华山的游客的福利—市内有免费班车到华山售票处。大家记住去的时候在哪儿下的车，回来也在哪儿上车。千万别在门口的路牌下傻等。
43,摄影师【四哥】,5,2019-05-02 22:41:32,建议先去其他几个，最后登它，因为最有意思吧
44,文墨,5,2019-04-30 13:58:27,早上9：30起，顺着自古华山一条，西门开始，北峰、南峰、东峰、中峰，最后到达西峰看日落，坐上缆车，飘飘荡荡下来；爬的慢，走走停停，山景无限好，基本都优于我之前爬的每一座山峰，特别是险峻——苍龙岭、千尺幢、百尺峡等等，仅华山二险——鹞子翻身、长空栈道太过惊险而未做体验，各险峻处，风光更绝，峭壁千尺，绿树厅石；特别美好的一次爬山体验。
45,温暖的菜菜,4,2019-04-29 15:45:43,如果报团选择一日游，建议选择西上北下的线路，因为北峰实在是太过陡峭，上山会非常累。需要提醒大家的是，华山以险著称，山路两旁都有铁链，爬山有时候会手脚并用，戴副手套可以避免划伤，也可以到景区购买，5元一副。山上的风景真的好美，就是风有点大，温度比山下要低5-6℃。
46,醉鸟,5,2019-04-26 22:48:07,"华山古称""西岳""，雅称""太华山""，为中国著名的五岳之一，中华文明的发祥地，""中华""和""华夏""之""华""，就源于华山 。位于陕西省渭南市华阴市，在省会西安以东120千米处。南接秦岭，北瞰黄渭，自古以来就有""奇险天下第一山""的说法。华山是道教主流全真派圣地，为""第四洞天""。（2008年10月26日）"
47,雪球狂舞,5,2019-04-17 15:50:07,华山，古称“西岳”，是我国著名的五岳之一，海拔2154.9米，位于陕西省西安以东120公里历史文化故地渭南市的华阴市境内，北临坦荡的渭河平原和咆哮的黄河，南依秦岭，是秦岭支脉分水脊的北侧的一座花岗岩山。
48,Kayi,4,2019-04-17 11:05:42,虽然有一句话叫“五岳归来不看山，黄山归来不看岳”，但是作为爬过黄山的人，在爬过华山之后，仍然觉得华山的奇险风光绝不在黄山之下。由于来的时候是7月末，属于旅游旺季，进山的人很多，而且大部分选的都是西上西下，或者西上北下的路线，节约体力。我们听从旅馆前台的建议，错峰登山，选择北上西下的路线，一来我对自己的体力还算有自信，二来排队实在枯燥，我宁愿用这个时间边走边歇，三是攻略都推荐的苍龙岭只有北上才有机会爬。所以和老婆商量以后，决定带儿子走北上西下的路线。其实北上西下相比爬黄山来说还好，毕竟北峰索道海拔已经在1500+了，而华山主峰南峰，海拔是2150+，实际只爬了600+，而且从北峰索道点到北峰只有不到100米，到金锁关基本是一路上行(不像黄山，动辄一二百米上下，体力消耗很大)。这次上山，8点开始进山，9点到达北峰顶，11点到达金锁关，之后上面四峰全走一遍，3点45开始排西峰下山索道，5点坐上下山的大巴，6点回到游客服务中心。因为带着孩子，整个过程基本上是爬10分钟歇3分钟，没有累得透支的感觉。山上的风景没的说，苍龙岭，天梯，都是必去的景点，东南西北中各领风骚。因为时间和胆量的原因，鹞子翻身没去，长空栈道维护关停。山上收费还好，毕竟山上的运输索道只能到一半，剩下的还是要靠人挑，比山下肯定要贵的，但是不离谱。这里我只想吐槽两件事:一个是山上的索道站，明知排队的人多，还让大家拥在一起，没有用护栏隔开，插队推搡的大有人在。其实用护栏把人流排成游龙状，既安全，又能实现先来后到的公平性。另一个是华阴市，完全感受不到旅游城市的感觉。晚上7点半以后，从高铁站只能打出租去景区，快车少的可怜，好不容易打到一个，司机还把单取消了。出租车乘降点写着不打表可以拒付，但实际上还是拼人头走，一个人5块，或者一趟车20。贵倒是不贵，但是你们是出租车，不是黑车，就应该按照出租车的管理办法营运。最气人的是，原本从华山到高铁站有免费的公交，大约20分钟一趟，这本身对游客是件好事，但是出租车为了揽活，夸大等候时间，贬低等车的游客，这真心不应该是陕西人的待客之道，不至于差评，但明显差距太大。
49,真大怪,5,2019-04-14 19:47:45,本次华山之行非常幸运，山下雨水不歇，从北峰索道上时雾深不识峰，到索道站后雾开景美，登顶用了四小时，云海绕铺山崖陡直令人莫忘。第二天的日出极为难得，紫崖红海，出了两小时太阳又出雾，幸运本次华山行。不足的是华山的生活设施，卫生间气味重，隔十数米仍烦人，其二住宿条件差且贵，三是生活用水稀缺，望改进！
50,花心绽放,5,2019-04-20 14:20:06,真的很陡啊，真是险，我下山的时候是坐着下来的，是真的坐着，挪下来的，没敢站直了走，台阶也窄。反正去过华山以后没再见过那么陡的山。云海很好看。去的时候来姨妈了，也没爬到后面。没到要用锁链挂身上过的地方。我同事过去了，第二天说晚上做梦，梦到自己 掉下去了、
51,foster,5,2019-07-24 13:14:53,14年夏天挑战华山之巅。五岳中最难爬的山，下午3点半，我从山脚的玉泉院开始，一直爬到了凌晨0点，终于到了山顶。整个过程永生难忘，在山顶上看到了从没见过的璀璨的银河。挨了一晚上的冻（6月份，我还穿了长袖，但是山顶风很大很冷），第二天早上看到了日出，很壮观的景象，之后又挑战了长空栈道。实在困的不行，赶紧坐缆车下山改签高铁票回程了！
52,阿蘅,5,2019-04-08 09:07:40,6月9号，和朋友一起，北上西下。这条路总体来说上坡多些，但是最累的也只是北峰到中锋的苍龙岭，其余路程还好。去之前我看推荐路线多的西上北下，个人觉得这条线路不科学，因为返程大部分是下坡，领略不到爬山的感觉，而且返程下坡很陡峭，苍龙岭也是下坡会有些遗憾。所以我选择了北上西下，挺好。长空栈道排队的很多就没去。确实很震撼，花岗岩、华山之险，一路都有卖锁的😂。山上一瓶矿泉水11，是挑夫挑上去的也不容易。最好自己带2-3瓶水，还有吃的。做好防晒。
53,羊驼阿宝,5,2019-04-06 22:07:18,4月23日去的，晚上十点半从玉泉院出发，快到6点时才到金锁关，一路上没怎么停，所以那些说体力好只要5个小时的真不是骗人的么？😂只好在金锁关看了日出，再出发去东峰，再是南峰，西峰。走到南天门的时候，整个人疲惫的不行，坐下休息闭着眼睛立马就能睡着的一种状态，深知不行，又继续行走。总算是走完几个峰，坐西峰索道下山，西峰索道很值得坐，风景很美，索道口建在山里，出去了之后往上看会有发觉甚是雄伟壮观。下山是一点半，回到游客中心差不多两点半，再坐车到玉泉院，开了钟点房，睡了一觉。景区和摆渡车都是24小时运营。爬山累的时候觉得这辈子再也不要来了，爬完之后一定要和喜欢的人再去一次，再去很多次都没关系。登山杖和手套是必须的，不管是否要夜爬。这次很傻的是天气不好预测，背了几件外套，结果因为一路上都很累，又出汗，到了山顶只穿了一件外套。吃的话建议士力架或者各种派，不要吃太甜的，红牛很有必要。
54,张,5,2019-04-05 21:51:53,说点干货1必须带雨衣拿雨伞。不要嫌麻烦 很可能晴天上去下雨2如果上午10点前就坐上了盘山大巴车，建议路线西上北下，这个路程长一点。全程相当于微信步数2万5左右。登山就是要多走。这个路线索道可以省钱，如果你体力好，时间够就选择西上北下。3做好心理准备，索道相比其他山，更刺激，时间大概18分钟。
55,white-stone,4,2019-07-24 13:16:42,本没计划去华山，自驾路过心血来潮就上去了，北上北下，亲眼看了看华山官方宣传照的景观就下来了，是不是从来没有人像我这样玩华山玩得那么水啊，哈哈
